Extraño;Hijo;Esposa;Padre
!Oh, me alegra que hayas llegado!;Confiamos en ti;Estoy asustada;Me enorgulleces
Bienvenido a mi pequeño juego, el destino de tu familia está en juego;Puedes salvarnos;!Por favor, salvanos!;Realmente te esfuerzas
Los he secuestrado y ahora debes salvarlos;!Por favor, sálvanos¡;¿Lo salvaste?;!Vamos!
Este es el trato, tengo una serie de preguntas preparadas;!Sé que lo lograrás!;¿Nuestro hijo esta bien?;!Eres increible!
Si respondes correctamente, tu familia será libre;!Eres mi heroe!;Siempre te amaré;Nada te detendrá
Pero si te equivocas…;!Nadie te va a derrotar!;Todo esto pasará;No pienses en el tiempo
Bueno, digamos que habrán consecuencias;!Estamos atrapados!;Te amo;No moriremos
!JAJAJA! ¿Estás listo?;Tu mente nos librará;Estoy muy nerviosa;Mañana nos reiremos de esto
