Ganaste;Perdiste Intro;AceptaTrato;No acepta Trato
Vaya, parece que lo has hecho muy bien.;Vaya, parece que has tenido algunos problemas.;Muy bien jajaja;Bueno, es tu decisión, aquí está tu familia.
Pero descuida, nos volveremos a ver.;Juguemos una vez más.;Aquí tengo 9 cajas, parte de ellas contiene una forma de librarte de todo, la cantidad depende del número de repuestas correctas que tuviste.;Espero que disfrutes su nuevo aspecto.
Las sombras siempre guardan secretos.;Si ganas, todo vuelve a la normalidad.;Las demás cajas no contienen nada.;Aunque ellos parece que no te recuerdan.
Y el destino teje hilos invisibles que nos llevarán a encontrarnos una vez más.;Pero si pierdes… jajajaja;Una vez que tomes el premio, no podrás dejarlo hasta que lo uses.;Jajajajaja
;;;
